[
  {
    "id": "legacy/and-true-true",
    "instructions": [["lit", true], ["lit", true], ["and"]],
    "expected": { "result": true },
    "features": ["legacy_logical"],
    "notes": "the bare and/or opcodes (ADR-0001): accepted by the evaluator forever but never emitted by the compiler, which always compiles source-level and/or to jump_if_falsy_or_pop/jump_if_true_or_pop instead (see short_circuit.json). Tier 1 by opcode; a v1 sibling must still run these."
  },
  {
    "id": "legacy/or-false-true",
    "instructions": [["lit", false], ["lit", true], ["or"]],
    "expected": { "result": true },
    "features": ["legacy_logical"]
  },
  {
    "id": "legacy/and-does-not-short-circuit",
    "instructions": [["lit", false], ["lit", true], ["and"]],
    "expected": { "result": false },
    "features": ["legacy_logical"],
    "notes": "docs/isa.md: and/or do not short-circuit - both operands are already on the stack by the time either opcode runs, unlike jump_if_falsy_or_pop/jump_if_true_or_pop"
  },
  {
    "id": "legacy/and-rejects-non-boolean",
    "instructions": [["lit", 1], ["lit", true], ["and"]],
    "expected": {
      "error": { "type": "TypeMismatchError", "reason": "logical_and" }
    },
    "features": ["legacy_logical"],
    "notes": "both operands must be booleans; anything else, including :undefined, is a TypeMismatchError"
  },
  {
    "id": "legacy/or-rejects-non-boolean",
    "instructions": [["lit", 1], ["lit", true], ["or"]],
    "expected": {
      "error": { "type": "TypeMismatchError", "reason": "logical_or" }
    },
    "features": ["legacy_logical"]
  }
]
