[
  {
    "id": "statements/store-root",
    "instructions": [
      ["lit", "x"],
      ["lit", 42],
      ["store", 1],
      ["load", "x"]
    ],
    "expected": {
      "result": 42
    },
    "notes": "store writes a root variable into the context; the trailing load observes the write, which is how store's effect is pinned from expression mode (docs/isa.md section 5)"
  },
  {
    "id": "statements/store-overwrites",
    "instructions": [
      ["lit", "x"],
      ["lit", 2],
      ["store", 1],
      ["load", "x"]
    ],
    "context": {
      "x": 1
    },
    "expected": {
      "result": 2
    },
    "notes": "the leaf is always overwritten, whatever it currently holds (docs/isa.md section 5)"
  },
  {
    "id": "statements/store-nested-vivifies-map",
    "instructions": [
      ["lit", "a"],
      ["lit", "b"],
      ["lit", 1],
      ["store", 2],
      ["load", "a"],
      ["access", "b"]
    ],
    "expected": {
      "result": 1
    },
    "notes": "a missing interior slot is auto-vivified as a map when the next segment is a string key"
  },
  {
    "id": "statements/store-index-vivifies-list",
    "instructions": [
      ["lit", "xs"],
      ["lit", 0],
      ["lit", 7],
      ["store", 2],
      ["load", "xs"],
      ["lit", 0],
      ["bracket_access"]
    ],
    "expected": {
      "result": 7
    },
    "notes": "a missing interior slot is auto-vivified as a list when the next segment is an integer index"
  },
  {
    "id": "statements/store-not-a-container",
    "instructions": [
      ["lit", "a"],
      ["lit", "b"],
      ["lit", 2],
      ["store", 2]
    ],
    "context": {
      "a": 1
    },
    "expected": {
      "error": {
        "type": "EvaluationError",
        "reason": "not_a_container"
      }
    },
    "notes": "the path traverses a.b, but a already holds a scalar - a put/3 LocationError wrapped in an EvaluationError per docs/isa.md section 5's error table"
  },
  {
    "id": "statements/store-insufficient-operands",
    "instructions": [
      ["lit", "x"],
      ["store", 1]
    ],
    "expected": {
      "error": {
        "type": "EvaluationError",
        "reason": "insufficient_operands"
      }
    },
    "notes": "store pops n + 1 values (the value plus n segments); only one value is on the stack here for n = 1"
  },
  {
    "id": "statements/store-non-scalar-segment",
    "instructions": [
      ["lit", true],
      ["lit", 1],
      ["store", 1]
    ],
    "expected": {
      "error": {
        "type": "TypeMismatchError",
        "reason": "store"
      }
    },
    "notes": "a location segment that is neither a string nor an integer is a TypeMismatchError, the mirror of bracket_access's key rule (docs/isa.md section 5)"
  },
  {
    "id": "statements/pop-discards-top",
    "instructions": [
      ["lit", 1],
      ["pop"],
      ["lit", 2]
    ],
    "expected": {
      "result": 2
    },
    "notes": "pop discards the stack top and pushes nothing, so the value the compiler emits pop after never becomes the expression's result"
  },
  {
    "id": "statements/pop-empty-stack",
    "instructions": [
      ["pop"]
    ],
    "expected": {
      "error": {
        "type": "EvaluationError",
        "reason": "insufficient_operands"
      }
    },
    "notes": "an empty stack at pop is insufficient operands, not the expression-mode empty_stack rule - that rule belongs to halt, not to an individual opcode"
  }
]
